{
  "id": "FermentedJuice",
  "name": "Jus fermenté",
  "description": "Un jus fermenté au parfum fruité unique, souvent utilisé comme marinade.",
  "recipes": [
    {
      
      "id": "TripesDuPort",
      "name": "Tripes du port"
    },
    {
      
      "id": "VessieChicken",
      "name": "Poularde en vessie"
    }
  ],
  "source": [
    "Épiceries de Fontaine"
  ]
}